{"amount_ledger":{"excluded_amount_gbp":431716.87,"excluded_by_reason_gbp":{"exact_duplicate":54228.42,"overlap_duplicate":377488.45},"identity":"raw_amount = kept_amount + excluded_amount","kept_amount_gbp":18855533.7,"raw_amount_gbp":19287250.57},"analytics_scopes":[{"analysis":"Revenue and reconciliation","rows_dropped_by_reason":{},"rows_in":1033036,"rows_out":1033036,"rule":"all kept lines"},{"analysis":"Product analytics (top SKUs, families, landscape)","rows_dropped_by_reason":{"nonproduct":5873,"refund":17914,"stock_adjustment":5955},"rows_in":1033036,"rows_out":1003294,"rule":"class = sale"},{"analysis":"Baskets (association rules)","rows_dropped_by_reason":{"nonproduct":5873,"refund":17914,"stock_adjustment":5955},"rows_in":1033036,"rows_out":1003294,"rule":"class = sale, guest invoices included, one basket per invoice"},{"analysis":"RFM, cohorts, CLV","rows_dropped_by_reason":{"guest_sale_lines":226717,"nonproduct":5873,"refund":17914,"stock_adjustment":5955},"rows_in":1033036,"rows_out":776577,"rule":"class = sale and Customer ID present (refunds enter monetary value only)"},{"analysis":"Weekly forecasting and newsvendor demand","rows_dropped_by_reason":{"incomplete_week_sale_lines":31151,"nonproduct":5873,"refund":17914,"stock_adjustment":5955},"rows_in":1033036,"rows_out":972143,"rule":"class = sale in complete Monday weeks"},{"analysis":"Price elasticity evidence","rows_dropped_by_reason":{"nonproduct":5873,"refund":17914,"stock_adjustment":5955},"rows_in":1033036,"rows_out":1003294,"rule":"class = sale, weekly modal unit price per SKU"}],"classes":[{"amount_gbp":-71340.22,"class":"nonproduct","rows":5873,"treatment":"In revenue totals; excluded from product and customer analytics.","units":10321},{"amount_gbp":-716425.97,"class":"refund","rows":17914,"treatment":"Negative revenue; matched LIFO to earlier sales of the same customer and SKU; not counted as purchases.","units":-467739},{"amount_gbp":19643299.89,"class":"sale","rows":1003294,"treatment":"Revenue and product and customer analytics (customer analytics only if Customer ID present).","units":11187870},{"amount_gbp":0.0,"class":"stock_adjustment","rows":5955,"treatment":"Zero-value write-offs and free items; amount is 0; excluded from product and customer analytics.","units":-320673}],"guest":{"amount_gbp":2565542.41,"amount_share":0.13606310227498236,"note":"Rows without Customer ID stay in revenue totals and baskets, and are excluded from RFM, cohorts and CLV.","row_share":0.22763098285054925,"rows":235151},"identities":[{"abs_diff":0.0,"description":"raw rows = kept rows + excluded rows","id":"rows_closure","lhs":1067371.0,"pass":true,"rhs":1067371.0},{"abs_diff":2.2724270820617676e-07,"description":"raw GBP = kept GBP + excluded GBP","id":"amount_closure","lhs":19287250.567997552,"pass":true,"rhs":19287250.56799778},{"abs_diff":0.0020022206008434296,"description":"sum of class amounts = kept GBP","id":"class_amounts","lhs":18855533.7,"pass":true,"rhs":18855533.69799778},{"abs_diff":0.0,"description":"sum of class rows = kept rows","id":"class_rows","lhs":1033036.0,"pass":true,"rhs":1033036.0},{"abs_diff":0.007997777312994003,"description":"sum of monthly revenue = kept GBP","id":"monthly_sum","lhs":18855533.69,"pass":true,"rhs":18855533.69799778},{"abs_diff":1.4938414096832275e-06,"description":"known-customer GBP + guest GBP = kept GBP","id":"customer_plus_guest","lhs":18855533.697999272,"pass":true,"rhs":18855533.69799778},{"abs_diff":0.0,"description":"matched + unmatched refund quantity = refunded quantity","id":"refund_qty_closure","lhs":467739.0,"pass":true,"rhs":467739.0},{"abs_diff":0.0,"description":"sheet rows sum to UCI instance count","id":"sheet_rows","lhs":1067371.0,"pass":true,"rhs":1067371.0},{"abs_diff":0.0,"description":"overlap rows excluded = rows of sheet 2 in the overlap window","id":"overlap_identical_copy","lhs":22523.0,"pass":true,"rhs":22523.0}],"monthly":[{"amount_gbp":796648.5,"month":"2009-12"},{"amount_gbp":622479.5,"month":"2010-01"},{"amount_gbp":531265.37,"month":"2010-02"},{"amount_gbp":763247.24,"month":"2010-03"},{"amount_gbp":587926.69,"month":"2010-04"},{"amount_gbp":613270.72,"month":"2010-05"},{"amount_gbp":677073.87,"month":"2010-06"},{"amount_gbp":573333.69,"month":"2010-07"},{"amount_gbp":654774.39,"month":"2010-08"},{"amount_gbp":851105.96,"month":"2010-09"},{"amount_gbp":1041685.61,"month":"2010-10"},{"amount_gbp":1416697.2,"month":"2010-11"},{"amount_gbp":746723.61,"month":"2010-12"},{"amount_gbp":558448.56,"month":"2011-01"},{"amount_gbp":497026.41,"month":"2011-02"},{"amount_gbp":682013.98,"month":"2011-03"},{"amount_gbp":492367.84,"month":"2011-04"},{"amount_gbp":722094.1,"month":"2011-05"},{"amount_gbp":689977.23,"month":"2011-06"},{"amount_gbp":680156.99,"month":"2011-07"},{"amount_gbp":681386.46,"month":"2011-08"},{"amount_gbp":1017596.68,"month":"2011-09"},{"amount_gbp":1069368.23,"month":"2011-10"},{"amount_gbp":1456145.8,"month":"2011-11"},{"amount_gbp":432719.06,"month":"2011-12"}],"raw_files":[{"bytes":45622418,"name":"online_retail_ii.zip","sha256":"572e36277c2390fbfde10664750731e0a86f55e33470d91919085f0408e67bfb"},{"bytes":45622278,"name":"online_retail_II.xlsx","sha256":"bcbe73b35f5b7babf197fb0cb983a11f5d9ff929078d4aa53d171b1f2df2e980"}],"refunds":{"invoices":7405,"lines":17914,"matched_lines":16001,"matched_qty":450259,"matching_rule":"LIFO within customer and SKU against earlier sale lines with unrefunded quantity; residual quantity is unmatched.","over_refund_lines":1711,"unmatched_no_customer_lines":328,"unmatched_no_prior_sale_lines":1711,"unmatched_qty":17480,"value_gbp":-716425.97},"retrieved_at":"2026-10-11T06:51:45+00:00","row_ledger":{"excluded":34335,"excluded_by_reason":{"exact_duplicate":11812,"overlap_duplicate":22523},"identity":"raw_rows = kept + excluded","kept":1033036,"raw_rows":1067371},"schema_version":"v1","sheets":[{"first_ts":"2009-12-01 07:45:00","last_ts":"2010-12-09 20:01:00","rows":525461,"sheet":"Year 2009-2010"},{"first_ts":"2010-12-01 08:26:00","last_ts":"2011-12-09 12:50:00","rows":541910,"sheet":"Year 2010-2011"}],"stockcode_classes":[{"amount_gbp":433410.51,"class":"postage","codes":["C2","C3","DOT","POST"],"rows":3789},{"amount_gbp":-242229.81,"class":"manual_adjustment","codes":["ADJUST","ADJUST2","B","D","M","S"],"rows":1742},{"amount_gbp":-264936.18,"class":"fees","codes":["AMAZONFEE","BANK CHARGES","CRUK"],"rows":152},{"amount_gbp":1686.61,"class":"voucher","codes":["GIFT_0001_10","GIFT_0001_20","GIFT_0001_30","GIFT_0001_40","GIFT_0001_50","GIFT_0001_60","GIFT_0001_70","GIFT_0001_80","GIFT_0001_90"],"rows":100},{"amount_gbp":525.15,"class":"other","codes":["DCGSLBOY","DCGSLGIRL","DCGSSBOY","DCGSSGIRL","GIFT","PADS","SP1002"],"rows":73},{"amount_gbp":203.5,"class":"test","codes":["TEST001","TEST002"],"rows":17}],"tags":{"classes":"OBSERVED","identities":"DERIVED","ledger":"OBSERVED","refunds":"DERIVED"}}
